question,option1,option2,option3,option4,correctAnswer,explanation,difficulty,practiceArea
Section 66-A of Information Technology Act was held unconstitutional in the case of,Justice K. S. Puttaswamy Vs Union of India,MP Sharma Vs Satish Chandra,Shreya Singhal Vs Union Of India,Gagan Harsh Sharma Vs The State of Maharashtra, Shreya Singhal Vs Union Of India,null,Advance,Constitutional Law
"A Teacher is not a workman within the purview of Industrial Disputes Act, held in the case of",The Workmen Vs Greaves Cotton & Co. Ltd. & Ors,John Joseph Khokar Vs Bhadange B. S. & ors,A. Sundarambal Vs Government of Goa,Dinesh Sharma and Ors. Vs State of Bihar, A. Sundarambal Vs Government of Goa,null,Advance,Labour & Industrial Law
According to Factories Act,"""child"" means a person who has not completed his fifteenth year of age;","""child"" means a person who has not completed his fourteenth year of age","""child"" means a person who has not completed his eighteenth year of age","""child"" means a person who has not completed his sixteenth year of age"," ""child"" means a person who has not completed his fifteenth year of age;",null,Basic,Labour & Industrial Law
This UNCITRAL Model Law and Rules do not become part of the Alternative Dispute Redressal Including Arbitration Actso as to become an aid to construe the provisions of the Act. - held in the case of,"Union of India Vs East Coast Boat Builders and Engineers Ltd.,",Union of India Vs M.C. Mehta,Tata Press Ltd Vs Union of India,Union of India Vs Indian Change Chrome Ltd," Union of India Vs East Coast Boat Builders and Engineers Ltd.,",null,Advance,Alternative Dispute Redressal including Arbitration Act
"According to Section 7(4) of the Arbitration and Conciliation Act, an arbitration agreement is in writing if it is contained in-",a document signed by the parties;,"an exchange of letters, telex, telegrams or other means of telecommunication which provide a record of the agreement;",an exchange of statements of claim and defence in which the existence of the agreement is alleged by one party and not denied by the other.,All of the above, All of the above,null,Intermediate,Alternative Dispute Redressal including Arbitration Act
Waiver of right to object deviance from arbitration agreement is mentioned under- ------- of the Arbitration and Conciliation Act,Section 7,Section 4,Section 20,Section 22, Section 4,null,Basic,Alternative Dispute Redressal including Arbitration Act
"A intentionally and falsely leads B to believe that certain land belongs to A, and thereby induces B to buy and pay for it. The land afterwards becomes the property of A, and A seeks to set aside the sale on the ground that, at the time of the sale, he had no title. He will not be allowed to prove his want of title. - Which Section of the Evidence Act is applicable?",Section 92,Section 124,Section 115,Section 101, Section 115,null,Intermediate,Evidence Act 
The Alternative Dispute Redressal Including Arbitration Act1996 repeals,"The Arbitration Act, 1940,","The Arbitration (Protocol and Convention) Act, 1937","the Foreign Awards (Recognition and Enforcement) Act, 1961.",All of the above, All of the above,null,Basic,Alternative Dispute Redressal including Arbitration Act
"Section 265A to 265L, Chapter XXIA of the Criminal Procedure Code deals with the concept of",Unlawful Assembly,Arrest without warrant,search and seizures,Plea bargaining, Plea bargaining,null,Basic,Cr. P. C. (Criminal Procedure Code)
Security for good behaviour from habitual offenders is dealt under,Section 109 of Cr.P.C.,Section 110 of Cr.P.C,Section 111 of Cr.P.C.,None of the above, Section 110 of Cr.P.C,null,Intermediate,Cr. P. C. (Criminal Procedure Code)
"X,Y, Z jointly promise to pay A an amount of Rs. 50,000/- Subsequently X,Y became untraceable. Can A compel Z to pay?","A can, under Section 43 para 1",A can under Section 49 para 1,"A cannot and will have to wait till X,Y become traceable",Z can be compelled only for one third," A can, under Section 43 para 1",null,Advance,Law of Contract
"Delivery of goods by one person to another for some purpose upon a contract that they shall, when the purpose is accomplished, be returned or disposed of according to the directions of the person delivering them. This process is termed as",Agency,Bailment,Guarantee,Contingency, Bailment,null,Basic,Law of Contract
"Section 14A inserted by THE SPECIFIC RELIEF (AMENDMENT) ACT, 2018, relates to",Power of the Courts to engage experts,Establishment of Special Court,Expeditious disposal of case,Specific performance with regard to contracts, Power of the Courts to engage experts,null,Basic,Specific Relief
Parliament may by law establish Administrative Tribunals under ............ of the Constitution,Article 323B,Article 323A,Article 233,Article 323, Article 323A,null,Intermediate,Constitutional Law
The Bar Council of India has to lay down the standards of professional conduct and etiquette for the Advocates under,"Section 3 of the Advocate Act, 1961","Section 7 (1) (b) of the Advocate Act, 1961","Section 17 of the Advocate Act, 1961","Section 18 of the Advocate Act, 1961"," Section 7  (b) of the Advocate Act, 1961",null,Basic,Professional Ethics & Cases of Professional Misconduct
According to Section 49 of the Advocate Act of 1961 the bar Council of India has power to make rules,qualifications for membership of a Bar Council and the disqualifications for such membership,the class or category of persons entitled to be enrolled as advocates,the standards of legal education to be observed by universities in India and the inspection of universities for that purpose.,All of the above, All of the above,null,Basic,Professional Ethics & Cases of Professional Misconduct
"Requisites of a valid adoption: no adoption shall be valid unless- (i) the person adopting has the capacity, and also the right, to take in adoption; (ii) the person giving in adoption has the capacity to do so; (iii) the person adopted is capable of being taken in adoption; and (iv) the adoption is made in compliance with the other conditions mentioned in this Chapter. - mentioned under",Section 6 of Hindu Adoptions and Maintenance Act,Section 8 of Hindu Adoptions and Maintenance Act,Section 12 of Hindu Adoptions and Maintenance Act,Section 10 of Hindu Adoptions and Maintenance Act, Section 6 of Hindu Adoptions and Maintenance Act,null,Basic,Family Law
"According to the Muslim women (protection of right son marriage) act, 2019, any pronouncement of talaq as defined under the Act by a Muslim husband upon his wife, by words, either spoken or written or in electronic form or in any other manner whatsoever, shall be",Void,Cognizable,compoundable,All of the above, Void,null,Basic,Family Law
The Hindu Succession (Amendment) Act (HSAA) 2005 provides for women:,coparcenary rights at par with men;,inheritance rights in agricultural land from her parents at par with her brothers;,inheritance of the self-acquired agricultural land of her deceased husband,All of the above, All of the above,null,Basic,Family Law
Section 25 of the Hindu Marriage Act provides for,Custody of the Children,Permanent alimony and maintenance,Maintenance Pendente lite,Division of matrimonial property, Permanent alimony and maintenance,null,Basic,Family Law
A Hindu wife had been living with her children and all the children had been brought up by her without any assistance and help from the husband many years. The wife was entitled to separate residence and maintenance under,Section 18 (2) (f) of Hindu Adoptions and Maintenance Act,Section 18 (2) (d) of Hindu Adoptions and Maintenance Act,Section 18 (2) (a) of Hindu Adoptions and Maintenance Act,Section 18 (2) (g) of Hindu Adoptions and Maintenance Act, Section 18  (a) of Hindu Adoptions and Maintenance Act,null,Basic,Family Law
Imposition of compensatory costs in respect of false or vexatious claims or defences is dealt under,Section 33 of CPC,Section 35A of CPC,Section 30 of CPC,Section 35 of CPC, Section 35A of CPC,null,Basic,C. P. C. (Code of Civil Procedure) 
Which provision under the Code of Civil Procedure deals with substituted service of summons upon the defendant,Order 5 Rule 19A,Order 5 Rule 19,Order 5 Rule 20,Order 5 Rule 21, Order 5 Rule 20,null,Advance,C. P. C. (Code of Civil Procedure) 
"The question is, whether A owes B rupees 10,000. Which of the following statements are relevant under Evidence Act;","The facts that A asked C to lend him money,","D said to C in A's presence and hearing ""I advise you not to trust A, for he owes B 10,000 rupees,""",A went away without making any answer,All of the above, All of the above,null,Intermediate,Evidence Act 
"So much of such information, whether it amounts to a confession or not, as relates distinctly to the fact thereby discovered by the police may be proved under",Section 25 of the Evidence Act,Section 26 of the Evidence Act,Section 27 of the Evidence Act,Section 29 of the Evidence Act, Section 27 of the Evidence Act,null,Basic,Evidence Act 
"When the Court has to form an opinion upon a point of foreign law or of science, or art, or as to identity of handwriting, or finger impressions, the opinions upon that point of persons specially skilled in such foreign law, science or art, or in questions as to identity of handwriting or finger impressions are relevant facts. this is under ........ of the Evidence Act",Section 42,Section 45,Section 50,Section 55, Section 45,null,Basic,Evidence Act 
"According to Environmental Protection Act, 1986, 'environmental pollutant' means","any solid, liquid or gaseous substance present in such concentration as may be, or tend to be, helpful to environment","only gaseous substance present in such concentration as may be, or tend to be, injurious to environment","any solid, liquid or gaseous substance present in such concentration as may be, or tend to be, injurious to environment","any solid, liquid present in such concentration as may be, or tend to be, injurious to environment"," any solid, liquid or gaseous substance present in such concentration as may be, or tend to be, injurious to environment",null,Advance,Environmental Law
National Green Tribunal cannot exercise its Jurisdiction with reference to,"Wildlife (Protection) Act, 1972","Scheduled Tribes and Other Traditional Forest Dwellers (Recognition of Forest Rights) Act, 2006","The Public Liability Insurance Act, 1991",both A & B, both A & B,null,Advance,Environmental Law
"An attempt to acquire sensitive information such as usernames, passwords, and credit card details (and sometimes, indirectly, money) by masquerading as a trustworthy entity in an electronic communication - is known as",Pharming,Smishing,Phishing,Didling, Phishing,null,Advance,Cr. P. C. (Criminal Procedure Code)
The Plea Bargaining is applicable only in respect of those offences for which punishment of imprisonment is up to a period of,7 years.,10 years,11 years,14 years, 7 years.,null,Advance,Cr. P. C. (Criminal Procedure Code)
"From a plain reading of Section 195 Cr.P.C. it is manifest that it comes into operation at the stage when the Court intends to take cognizance of an offence under Section 190(1) Cr PC.; and it has nothing to do with the statutory power of the police to investigate into an F.I.R. which discloses a cognizable offence.... In other words, the statutory power of the Police to investigate under the Code is not in any way controlled or circumscribed by Section 195 Cr.P.C."" - This was held by the Supreme Court in the case of",Nalini Vs State of Tamilnadu,Raj Singh Vs State (1998),Shamsher Singh Vs State of Punjab,State of Himachal Pradesh Vs Tara Dutta, Raj Singh Vs State (1998),null,Advance,Cr. P. C. (Criminal Procedure Code)
Indemnity contract is defined under,Section 124 of the Indian Contract Act,Section 67 of the Indian Contract Act,Section 127 of the Indian Contract Act,Section 128 of the Indian Contract Act, Section 124 of the Indian Contract Act,null,Intermediate,Law of Contract
Peek Vs. Gurney is a famous case related to,Coercion,Fraud,Mistake of fact,Mistake of law, Fraud,null,Advance,Law of Contract
"Which provision under Criminal procedure Code, 1973 deals with the procedure to be adopted by the Magistrate to record confessions and statements?",Section 162,Section 164,Section 163A,Section 165, Section 164,null,Basic,Cr. P. C. (Criminal Procedure Code)
Attachment of property of person absconding can be done under Section ........ of Cr.P.C.,83,82,85,86,83,null,Basic,Cr. P. C. (Criminal Procedure Code)
Magistrate may dispense with personal attendance of accused under Section ....... of Cr.P.C,201,204,205,200,205,null,Basic,Cr. P. C. (Criminal Procedure Code)
The Supreme Court invoked the principle of Transformative Constitutionalism' in the case of,Navtej Singh Johar Vs Union of India (2018),Suresh Kumar Koushal Vs Naz Foundation (2010),"Naz Foundation Vs Government of NCT of Delhi, (2009)","Aruna Roy Vs Union of India, (2002)", Navtej Singh Johar Vs Union of India (2018),null,Advance,Constitutional Law
The provisions of Indian Penal Code apply also to any offence committed by,any citizen of India in any place without and beyond India;,any person on any ship or aircraft registered in India wherever it may be,any person in any place without and beyond India committing offence targeting a computer resource located in India.,All of the above, All of the above,null,Intermediate,I. P. C. (Indian Penal Code)
Section 105 (H) of Cr.P.C deals,Forfeiture of property in certain cases.,Notice of forfeiture of property,Management of properties seized or forfeited,Identifying unlawfully acquired property, Forfeiture of property in certain cases.,null,Basic,Cr. P. C. (Criminal Procedure Code)
Bar to taking cognizance after lapse of the period of limitation is dealt under,Section 178 of Cr. P.C.,Section 469 of Cr. P.C.,Section 478 of Cr. P.C.,Section 168 of Cr. P.C., Section 469 of Cr. P.C.,null,Intermediate,Cr. P. C. (Criminal Procedure Code)
"""decree-holder"" means",any person in whose favour a decree has been passed or an order capable of execution has been made,any person in whose favour a decree has been passed or an order incapable of execution has been made,any Citizen in whose favour a decree has been passed or an order capable of execution has. been made,any corporation in whose favour a decree has been passed or an order capable of execution has been made, any person in whose favour a decree has been passed or an order capable of execution has been made,null,Intermediate,C. P. C. (Code of Civil Procedure)
Under the Patent Act which of the following are not patentable?,a method of agriculture horticulture,a presentation of information,topography of integrated circuits,All of the above, All of the above,null,Advance,Intellectual Property Laws 
World Intellectual Property Organization (WIPO) has replaced pre- existing,GATT,BIRPI,TPRM,PCT, BIRPI,null,Advance,Intellectual Property Laws 
"Anuradha Bhasin Vs Union of India on 10 January, 2020 relates to a challenge under Article 32 of the Constitution seeking issuance of an appropriate writ",for setting aside orders of the Government by which all modes of communication including Internet have been shut down in J&K,for setting aside orders of the Government by which private property was sought to be acquired in J&K,for setting aside orders of the Government by which J&K was constituted as a UT,for setting aside orders of the Government by which Ladakh was separated., for setting aside orders of the Government by which all modes of communication including Internet have been shut down in J&K,null,Advance,Constitutional Law
Section 66A of the Information Technology Act was struck down under Art. 19(1) (a) read with Article 19 (2) in the case of,Justice K. S. Puttaswamy Vs Union of India,Kharak singh Vs State of U.P.,Govinda Vs State of M.P.,Shreya Singhal Vs Union of India, Shreya Singhal Vs Union of India,null,Advance,Cyber Law
Article 145(3) of the Indian Constitution states that The minimum number of Judges who are to sit for the purpose of deciding any case involving a substantial question of law as to the interpretation of this Constitution or for the purpose of hearing any reference under Article 143 shall be....,Two,Three,Five,Nine, Five,null,Intermediate,Constitutional Law
The utility of Public Interest Litigation,Liberalised locus standi,The proceedings are non-Adversarial,Procedural requirements are liberalized,All of the above, All of the above,null,Advance,Environmental Law
"The petitioner, a professor of political science who had done substantial research and deeply interested in ensuring proper implementation of the constitutional provisions, challenged the practice followed by the state of Bihar in repromulgating a number of ordinances without getting the approval of the legislature. The court held that the petitioner as a member of public has 'sufficient interest' to maintain a petition under Article 32- This relates to the case of","Parmanand Katara Vs Union of India AIR 1989, SC 2039","D.C.Wadhwa Vs State of Bihar, AIR 1987 SC 579",Neeraja Choudhari Vs State of Madhya Pradesh AIR 1984SC1099,"Chameli Singh Vs State of U.P. AIR 1996,SC1051"," D.C.Wadhwa Vs State of Bihar, AIR 1987 SC 579",null,Advance,Constitutional Law
"Where a legal wrong or a legal injury is caused to a person or to a determinate class of persons by reason of violation of any constitutional or legal right or any burden is imposed in contravention of any constitutional or legal provision or without authority of law or any such legal wrong or legal injury or illegal burden is threatened and such person or determinate class of persons by reasons of poverty, helplessness or disability or socially or economically disadvantaged position unable to approach the court for relief, any member of public can maintain an application for an appropriate direction, order or writ in the High Court under Article 226 and in case any breach of fundamental rights of such persons or determinate class of persons, in this court under Article 32 seeking judicial redress for the legal wrong or legal injury caused to such person or determinate class of persons."" - Justice Bhagwati in the case of",Peoples Union for Democratic Rights Vs Union of India,Ashok Kumar Pandey Vs State of West Bengal,S. P. Gupta Vs Union of India,Janata Dal Vs H. S. Chowdhary, S. P. Gupta Vs Union of India,null,Advance,Constitutional Law
The definition of 'money' under GST law does not include,Letter of Credit,Currency held for numismatic value,Pay order,Traveler cheque, Currency held for numismatic value,null,Intermediate,Law related to Taxation
Under Article 279A GST Council is constituted by,Prime Minister and his Council of Ministers,Respective Governors of the State,The President,A collective body of Union and States, The President,null,Basic,Constitutional Law
The definition of Contract is defined under,Section 2(a) of the Indian Contract Act.,Section 2(h) of the Indian Contract Act.,Section 2(d) of the Indian Contract Act.,Section 2(g) of the Indian Contract Act., Section 2(h) of the Indian Contract Act.,null,Basic,Law of Contract
Voluntarily throwing or attempting to throw acid is an offence punishable under,Section 326 B of the Indian Penal Code,Section 120 B of the Indian Penal Code,Section 509 of the Indian Penal Code,Section 295B of the Indian Penal Code, Section 326 B of the Indian Penal Code,null,Intermediate,I. P. C. (Indian Penal Code)
"A is at work with a hatchet; the head flies off and kills a man who is standing by. Here, if there was no want of proper caution on the part of A, his act is",An Offence of murder,An offence of Culpable homicide,Not an offence,An Offence of causing grievous hurt, Not an offence,null,Intermediate,Cr. P. C. (Criminal Procedure Code)
"A, with the intention of causing Z to be convicted of a criminal conspiracy, writes a letter in imitation of Z's handwriting, purporting to be addressed to an accomplice in such criminal conspiracy, and puts the letter in a place which he knows that the officers of the police are likely to search-A has committed an Offence under",Section 256 of IPC,Section 192 of IPC,Section 195 A of IPC,Section 201(a)of IPC, Section 192 of IPC,null,Intermediate,I. P. C. (Indian Penal Code)
"India, that is Bharat, shall be a",Federation of States,quasi federal,Union of states,Unitary state of a special type, Union of states,null,Basic,Constitutional Law
"In M.C. Mehta Vs. Union of India, AIR 1987 SC1086 (Sri Ram Fertilizers case) the court held that",In escape of toxic gas the enterprise is strictly and absolutely liable to compensate all those who are affected by the accident and such liability is not subject to any of the exceptions which operate vis-a-vis the tortious principle of strict liability.,In escape of a dangerous animal the owner is strictly and absolutely liable to compensate all those who are affected by the accident and such liability is not subject to any of the exceptions which operate vis-a-vis the tortious principle of strict liability.,In escape of toxic gas the enterprise is strictly liable to compensate all those who are affected by the accident and such liability is subject to any of the exceptions which operate vis-a-vis the tortious principle of strict liability,A company or a corporation is not a state and hence not liable for leak of toxic gas affecting the health of the people, In escape of toxic gas the enterprise is strictly and absolutely liable to compensate all those who are affected by the accident and such liability is not subject to any of the exceptions which operate vis-a-vis the tortious principle of strict liability.,null,Advance,Law of Tort
"Under Section 70 of the Indian Contract Act, Where a person lawfully does anything for another person, or delivers anything to him, not intending to do so gratuitously, and such other person enjoys the benefit thereof, the latter is bound to make compensation to the former in respect of, or to restore, the thing so done or delivered. This principle is known as",A Contract of Uberrimae fide,Implied Agency,Quantum meruit,De nova contract, Quantum meruit,null,Intermediate,Law of Contract
Agreement is,a promise or set of promises forming consideration to each other,enforceable by law,enforceable contract,Un enforceable by law, a promise or set of promises forming consideration to each other,null,Basic,Law of Contract
"Under the Land Acquisition Act, the expression ""land"" includes",benefits to arise out of land,things attached to the earth,things permanently fastened to anything attached to the earth,All of the above, All of the above,null,Intermediate,Land Acquisition Act
"Temporary occupation of waste or arable land, procedure when difference as to compensation exists is provided under",Section 32 of Land Acquisition Act,Section 30 of Land Acquisition Act,Section 35 of Land Acquisition Act,Section 31 of Land Acquisition Act, Section 35 of Land Acquisition Act,null,Basic,Land Acquisition Act
Suits by indigent persons is dealt under,Order 44 of C.P.C,Order 33 of C.P.C,Order 55 of C.P.C,Order 22 of C.P.C, Order 33 of C.P.C,null,Basic,C. P. C. (Code of Civil Procedure)
"Res gestae, Relevancy of facts forming part of same transaction is dealt under",Section 6 of the Evidence Act,Section 17 of the Evidence Act,Section 18 of the Evidence Act,Section 20 of the Evidence Act, Section 6 of the Evidence Act,null,Basic,Evidence Act 
"Among other things, the Function of Bar council of India includes laying down standards of professional conduct and etiquette for advocates. - Under which section of the Advocates Act",Section 7,Section 8,Section 9,Section 6, Section 7,null,Intermediate,Professional Ethics & Cases of Professional Misconduct
"According to Justice 'Abbot Parry' what are the ""Seven Lamps of Advocacy"".","(i) Honesty (ii) Courage (iii) professionalism (iv) Wit (v) Eloquence, (vi) Judgment and (vii) Fellowship.","(i) Honesty (ii) Courage (iii) Industry (iv) Wit (v) Eloquence, (vi) Judgment and (vii) Fellowship.","(i) influence (ii) Courage (iii) Industry (iv) Wit (v) Eloquence, (vi) Judgment and (vii) Fellowship.","(i) Honesty (ii) Courage (iii) Industry (iv) seriousness (v) Eloquence, (vi) Judgment and (vii) Fellowship."," (i) Honesty (ii) Courage (iii) Industry (iv) Wit (v) Eloquence, (vi) Judgment and (vii) Fellowship.",null,Advance,Professional Ethics & Cases of Professional Misconduct
Minimum number of Directors in a Public company,3,10,12,5,3,null,Intermediate,Company Law
"An associate company, in relation to another company, means","a company in which that other company has a significant influence, but which is a subsidiary company of the company having such influence and includes a joint venture company","a company in which that other company has a significant influence, but which is not a subsidiary company of the company having such influence and includes a joint venture company","a company in which that other company has a significant influence, but which is not a subsidiary company of the company having such influence and does not include a joint venture company","a company in which that other company has full shares, and is a subsidiary company of the company having such influence and includes a joint venture company"," a company in which that other company has a significant influence, but which is not a subsidiary company of the company having such influence and includes a joint venture company",null,Advance,Company Law
The Supreme Court has legalised living wills and passive euthanasia subject to certain conditions in the case of,Aruna Ramachandra Shanbaug Vs Union of India (2011),"Common Cause Vs Union of India, (2018) 5 SCC 1.",Gian Kaur Vs State of Punjab (1996),D Chenna Jagadeeswar Vs State of A.P. (1988)," Common Cause Vs Union of India, (2018) 5 SCC 1.",null,Advance,Constitutional Law
