question,option1,option2,option3,option4,correctAnswer,explanation,difficulty,practiceArea
Article 310 of the Constitution mentions about,Doctrine of Immunities and Instrumentalities with reference to civil servants,Doctrine of legitimate expectation with reference to civil servants,Doctrine of natural justice with reference to civil servants,Doctrine of pleasure with reference to civil servants is, Doctrine of pleasure with reference to civil servants is,null,Basic,Constitutional Law
Right to know the antecedents of the candidates in the election flow from,Article 19 (1) (a),Article 20,Article 13,Article 14, Article 19  (a),null,Intermediate,Constitutional Law
"In the Preamble of the Indian Constitution, the expression 'liberty' is followed by the words",of status and opportunity,"of thought, expression, belief, faith and worship",Assuring the dignity of the individual,"Justice, social economic and political"," of thought, expression, belief, faith and worship",null,Advance,Constitutional Law
"According to Income Tax Act ""zero coupon bond"" means a bond","issued by any infrastructure capital company or infrastructure capital fund or public sector company or scheduled bank on or after the 1st day of June, 2005;",in respect of which no payment and benefit is received or receivable before maturity or redemption from infrastructure capital company or infrastructure capital fund or public sector company or scheduled bank,"which the Central Government may, by notification in the Official Gazette, specify in this behalf.",All of the above, All of the above,null,Advance,Law related to Taxation 
Provisions relating to GST are inserted in the Constitution by,The Constitution (one hundred and first) Act 2016,The Constitution (one hundred and second) Act 2016,The Constitution (eighty fourth) Act 2016,The Constitution (seventy-seven) Act 2016, The Constitution (one hundred and first) Act 2016,null,Intermediate,Constitutional Law
"A is accused of waging war against the Government of India by taking part in an armed insurrection in which property is destroyed, troops are attacked, and goals are broken open. The occurrence of these facts is relevant, as forming part of the general transaction, though A may not have been present at all of them. - under which section of the India Evidence Act.",Section 12,Section 6,Section 3,Section 5, Section 6,null,Intermediate,Evidence Act 
Section 110 of the Evidence Act deals with,Documentary Evidence,Exclusion of Oral Evidence,Burden of proof as to ownership,Proof of guilt., Burden of proof as to ownership,null,Basic,Evidence Act 
Section 113 (a) of the Evidence Act deals with,Presumption as to abetment of murder,Presumption as to rape and abetment of suicide by a woman,Presumption as to abetment of kidnap of a girl,Presumption as to abetment of suicide by a married woman, Presumption as to abetment of suicide by a married woman,null,Advance,Evidence Act 
In which of the following case the offence of sedition was in issue,Queen Empress Vs Bal Gangadhar Tilak,Niharendu Dutt Mazumdar Vs Emperor,Kedar Nath singh Vs State of Bihar,All of the above, All of the above,null,Advance,Cr. P. C. (Criminal Procedure Code)
"Deliberate and malicious acts, intended to outrage religious feelings of any class by insulting its religion or religious beliefs. - is an offence under",Section 295,Section 295A,Section 265A,Section 276, Section 295A,null,Intermediate,Cr. P. C. (Criminal Procedure Code)
Under Section 29 of Cr.P.C. The Court of a Chief Judicial Magistrate may pass any sentence authorized by law except,A sentence of death,Imprisonment for life,Imprisonment for a term exceeding seven years.,All of the above, All of the above,null,Basic,Cr. P. C. (Criminal Procedure Code)
Provision regarding filing of suits by an alien under the Code of Civil procedure is dealt under,Section 21A,Section 15,Section 218,Section 83, Section 83,null,Intermediate,C. P. C. (Code of Civil Procedure)
"An order issued by court under Civil Procedure Code 1908 as per order XXI, rule 46, for recovery of amount due to judgment creditor - is known as",IT Order,Garnishee Order,Decree Holder order,Bank Order, Garnishee Order,null,Intermediate,C. P. C. (Code of Civil Procedure)
"Section 88 read with Order XXXV of the Code of Civil Procedure, 1908 deals with",Interpleader suit,Interlocutory Order,Restitution Order,Attachment Order, Interpleader suit,null,Intermediate,C. P. C. (Code of Civil Procedure)
Vis major means,Act of God,Act of Individual,Act of other party,Act of plaintiff, Act of God,null,Advance,Law of Tort
According to Classical doctrine of Act of State in law of Torts means,"an act of the sovereign power of a country, that cannot be challenged, controlled or interfered with by municipal courts","an act of the Judiciary of a country, that cannot be challenged, controlled or interfered with by municipal courts","an act of the sovereign power of a country, that can be challenged, controlled or interfered with by municipal courts",None of the above," an act of the sovereign power of a country, that cannot be challenged, controlled or interfered with by municipal courts",null,Advance,Law of Tort
"In Torts, all persons who aid, or counsel, or direct or join in the committal of a wrongful act, are known as",Abettors,Joint tortfessors.,Tort holders,Tort holders in common, Joint tortfessors.,null,Advance,Law of Tort
M.C. Mehta Vs Union of India 1986 Shriram food and Fertilisers case relates to,Olieum Gas leak,Ganga water cleaning,Child labour,Bonded labour, Olieum Gas leak,null,Advance,Environmental Law
A. K. Kraipak Vs Union of India relates to,Likelihood of Bias,Delegated Legislation,Administrative Discretion,Notice, Likelihood of Bias,null,Advance,Constitutional Law
Judicial control of Delegated Legislation may be exercised on the ground of,Doctrine of Ultravires,Malafides,Exclusion of Judicial Review,All of the above, All of the above,null,Advance,Constitutional Law
The principle of Res Judicata is dealt under Section ---- of CPC,9,10,11,12,11,null,Basic,C. P. C. (Code of Civil Procedure)
Section 14 of the C.P.C. deals with,Presumption as to decisions of tribunals,Presumption judgments as to foreign,Presumption as to judgments of the lower court,Presumption as to judgments of High Court, Presumption judgments as to foreign,null,Basic,C. P. C. (Code of Civil Procedure)
"A, residing in Delhi, publishes in Kolkata statements defamatory of B. B may sue A",Only in Delhi,Only in Kolkata,in both the place of Delhi and Kolkata,either in Kolkata or in Delhi., either in Kolkata or in Delhi.,null,Advance,Law of Tort
"""Mere illegality of the strike does not per se spell unjustifiability"" - Justice Krishna lyer. Name the case.",Chandramalai workmen Estate Vs Its,"Associated Cement Ltd., Vs Their workmen",Gujarat Steel Tubes Vs Gujarat Steel Tubes Mazdoor Sabha,"Indian General Navigation of Railway Co. Ltd., Vs Their workmen", Gujarat Steel Tubes Vs Gujarat Steel Tubes Mazdoor Sabha,null,Advance,Constitutional Law
A workman aggrieved by the order of ............... may directly make an application to the labour court or tribunal for adjudication of the dispute and the court/tribunal is empowered to adjudicate such dispute as it had been referred to it by the appropriate government,"Dismissal, discharge and retrenchment","Dismissal, discharge, retrenchment or otherwise termination of service",Discharge simpliciter exclusively,Dismissal and retrenchment exclusively," Dismissal, discharge, retrenchment or otherwise termination of service",null,Advance,Labour & Industrial Law
The national consumer dispute redressal commission was constituted in the year,1988,1998,1999,1997,1988,null,Advance,Consumer Protection Act
"What is the limitation period applicable to the three forums in entertaining a complaint under The Consumer Protection Act, 1986",3 years from the date on which the cause of action has arisen,5 years from the date on which the cause of action has arisen,4 years from the date on which the cause of action has arisen,2 years from the date on which the cause of action has arisen, 2 years from the date on which the cause of action has arisen,null,Intermediate,Consumer Protection Act
"Under Section 82 of the Indian Penal Code, nothing is an offence which is done by a child under the age of.",14 years,7 years,18 years,21 years, 7 years,null,Basic,I. P. C. (Indian Penal Code)
R. V. Dudley & Stephen stands for the principle that,Killing an innocent life to save his own is not a defence and necessity cannot be pleaded as a defence against murder,"Necessity can be pleaded as a defence against murder, killing an innocent life to save his own may become inevitable",Killing out of mercy is a defence and necessity cannot be pleaded as a defence against murder.,None of the above, Killing an innocent life to save his own is not a defence and necessity cannot be pleaded as a defence against murder,null,Advance,Cr. P. C. (Criminal Procedure Code)
"On and from the commencement of the Hindu Succession (Amendment) Act, 2005, in a Joint Hindu family governed by the Mitakshara law, conferring on daughter coparcenary status by substituting new section for",Section 6,section 10,Section 11,Section 13, Section 6,null,Basic,Family Law
Section 5 of Hindu Marriage Act relates to,Void marriages,Voidable marriages,Ceremonies of Hindu marriage,Conditions of Hindu marriage, Conditions of Hindu marriage,null,Basic,Family Law
A marriage between a girl of 22 years marries her maternal uncles son of 23 years in accordance with the Special Marriage Act. Such marriage is,Valid,Voidable,Void,Valid only in north India, Void,null,Basic,Family Law
